{
  "schema_version": "spac.simulation-run.v0",
  "architecture_name": "hft_8p_full_lookup_rr",
  "trace_name": "hft_tiny",
  "trust_level": "software_model",
  "supported_model": {
    "forwarding_table": "full_lookup",
    "voq": "n_by_n",
    "scheduler": "round_robin"
  },
  "metrics": {
    "packets_received": 3,
    "packets_forwarded": 3,
    "packets_dropped": 0,
    "drop_rate": 0.0,
    "simulation_duration_ns": 81,
    "throughput_packets_per_ns": 0.037037037037037035,
    "throughput_gbps": 7.111111111111111,
    "latency_ns": {
      "p50": 15,
      "p95": 15,
      "p99": 15,
      "max": 15
    },
    "queue_occupancy_max": 1,
    "peak_voq_occupancy_packets": [
      0,
      0,
      1,
      0,
      0,
      0,
      0,
      0,
      0,
      0,
      0,
      1,
      0,
      0,
      0,
      0,
      0,
      0,
      0,
      0,
      1,
      0,
      0,
      0,
      0,
      0,
      0,
      0,
      0,
      0,
      0,
      0,
      0,
      0,
      0,
      0,
      0,
      0,
      0,
      0,
      0,
      0,
      0,
      0,
      0,
      0,
      0,
      0,
      0,
      0,
      0,
      0,
      0,
      0,
      0,
      0,
      0,
      0,
      0,
      0,
      0,
      0,
      0,
      0
    ],
    "bank_conflicts": 0,
    "lookup_stall_cycles": 0,
    "estimated_initiation_interval": 1,
    "line_rate_achieved_ratio": 1.0,
    "rx_utilization": 0.037037037037037035,
    "hash_utilization": 0.037037037037037035,
    "scheduler_utilization": 0.037037037037037035,
    "per_port_forwarded": [
      0,
      0,
      1,
      1,
      1,
      0,
      0,
      0
    ],
    "per_port_dropped": [
      0,
      0,
      0,
      0,
      0,
      0,
      0,
      0
    ]
  },
  "packet_outcomes": [
    {
      "flow_id": "hft_order_flow_0",
      "ingress_port": 0,
      "egress_port": 2,
      "status": "forwarded",
      "timestamp_ns": 0,
      "completion_ns": 15,
      "latency_ns": 15
    },
    {
      "flow_id": "hft_order_flow_1",
      "ingress_port": 1,
      "egress_port": 3,
      "status": "forwarded",
      "timestamp_ns": 40,
      "completion_ns": 55,
      "latency_ns": 15
    },
    {
      "flow_id": "hft_order_flow_2",
      "ingress_port": 2,
      "egress_port": 4,
      "status": "forwarded",
      "timestamp_ns": 80,
      "completion_ns": 95,
      "latency_ns": 15
    }
  ],
  "warnings": [
    "software_model trust level: no HLS synthesis, RTL simulation, timing closure, or FPGA measurement was performed"
  ]
}